1,adult,backdrop_path,genre_ids,id,original_language,original_title,overview,popularity,poster_path,release_date,title,video,vote_average,vote_count
0,False,,"[12, 28, 878]",879236,en,Star Wars Wars,"The six Star Wars films playing at the same time. The films are synchronized to the very first frame of the main title, STAR WARS, as to not allow the varying lengths and start times of the 20th Century Fox logo to influence possible narrative outcomes in the films. Visually the films were layered into Adobe After Effects at 100% opacity. The blending mode ""Lighter Color"" was chosen because its blending properties operated the same no mater what the layer order was. It was important to me that each film had equal opportunity. The ""Lighter Color"" blending mode gives preference to brighter pixels, therefore brighter scenes obliterate darker scenes.",0.926,/nULCrA6l8AYWGzWc6DHN2kSOMZu.jpg,2015-06-16,Star Wars Wars,False,0.0,0
1,False,/3t1CxhG0P3H2kv866Vgh1ETUwKi.jpg,[99],501244,fr,Star wars 40 ans,,0.963,/oMMkmBbwgjbOpPLuIZnNsBAfyUs.jpg,2017-10-19,Star wars 40 ans,False,6.8,2
2,False,,"[10751, 16]",292404,en,Star Wars: Ewoks - The Haunted Village,"Morag the Tulga Witch seeks revenge on her old enemy Logray, shaman of the Ewoks, who holds the magic Sunstar while she possesses it's darker half, the Shadowstone.",1.303,/v6k8pHBvG15UYWhcsjb2aeGvWYY.jpg,1997-02-11,Star Wars: Ewoks - The Haunted Village,False,0.0,0
3,False,,"[99, 35]",521298,en,Star Wars Nothing But Star Wars,"The STAR WARS NOTHING BUT STAR WARS video mixtape is the ultimate feature-length comedy compilation documenting the last 40 years of the the Star Wars phenomenon and comprised entirely of unseen, lost, forgotten and is-this-real-or-am-I-dreaming archival Original Trilogy video madness.  Featuring Star Wars ripoffs, Star Wars TV specials, Star Wars commercials, Star Wars interviews and even shameless Star Wars pornography [rated R].  It’s Star Wars gone wild, gone weird and gone wrong, and there’s nothing else like it.  C-3PO rapping?  It’s here. Mark Hamill turns into a homicidal maniac?  Yep, we got it.  Jabba the Hutt Italo disco? Check. Tusken Raider Voyeur Pornography? Oh yeah, and lots of it. You’ve never seen Star Wars like this and you’ll never see Star Wars quite the same way after watching.",0.6,/50Xf9wCG3OK2xvaEnZO7ZcmlPCa.jpg,2017-05-29,Star Wars Nothing But Star Wars,False,5.0,1
4,False,,[99],533721,en,The Stories: The Making of 'Rogue One: A Star Wars Story',The Making of 'Rogue One: A Star Wars Story',4.067,/xuI27etRYWk7vP0aCUTTnIfnpC4.jpg,2017-04-04,The Stories: The Making of 'Rogue One: A Star Wars Story',False,6.6,5
5,False,,"[28, 12, 878]",890826,en,Star Wars: Revelations,"Seers once shaped the path of the Jedi Order. But their visions grew unreliable and the Jedi came to distrust those with the ability. Seers hid their visions or left the Order forever.  In the wake of the Temple's destruction a power struggle has emerged between Darth Vader, the Dark Lord of the Sith, and Zhanna, the Emperor's Hand. Each seek to eliminate the last of the Jedi and gain the Emperor's favor.  Caught between them is one woman who cannot deny the truth of her visions as all race to possess an ancient Jedi secret.",0.84,/lk1wXxCwg4MgVcBMtoEw4bh9kLi.jpg,2005-04-16,Star Wars: Revelations,False,5.0,2
6,False,,[16],102817,en,Quentin Tarantino's Star Wars,"We're all familiar with the story: a long time ago in a galaxy far, far away, on a planet called Tattooine, a boy named Luke Skywalker is adopted by the only remaining Jedi knight and helps the Rebellion destroy the Death Star after learning the ways of the force. However, what if ""Pulp Fiction"" director Quentin Tarantino had directed George Lucas' script, using Kenner action figures and stop computer animation?",0.887,,2002-06-09,Quentin Tarantino's Star Wars,False,5.3,6
7,False,,"[10751, 16]",292410,en,Star Wars: Ewoks - Tales from the Endor Woods,"Wicket remembers four memorable adventures from his youth: how he fixed up his great grandfather's battle wagon, the occasion when Latara ran away from the Ewok village to join the traveling Jindas, the time his father Deej fell terrible ill and the story of Kneesa's long lost sister, Asha.",1.844,/owuYP5om2VYb9txYsveEEtuUZ2X.jpg,1997-02-11,Star Wars: Ewoks - Tales from the Endor Woods,False,7.0,1
8,False,,"[99, 10402]",219566,en,Star Wars: Music by John Williams,BBC documentary. Witness John Williams composing the legendary score for The Empire Strikes Back and conducting the London Symphony Orchestra.,1.838,,1980-05-18,Star Wars: Music by John Williams,False,8.0,2
9,False,,[],654663,en,Robot Chicken: Star Wars Trilogy,All three of the Robot Chicken Star Wars specials (Episodes 1-3).,1.429,/pSBmtqNBOe47ImbLWcAE7a2juNL.jpg,2010-12-19,Robot Chicken: Star Wars Trilogy,True,0.0,0
10,False,,[99],507052,en,Star Wars: The Force of Sound,"Go inside the sound design of Star Wars: The Last Jedi. From the ignition of a lightsaber to the chirp of a porg, Star Wars would not be the same without the brilliant sound design and mixing created by Skywalker Sound.",1.747,/q41hKQWdZVoGx4aNd8Ul2oFeaBW.jpg,2018-02-20,Star Wars: The Force of Sound,False,8.0,2
11,False,,[],779205,en,WCCW Christmas Star Wars '87,The High Holidays bring high tension deep in the heart of Texas. Can The Von Erich's come out unscathed?,1.026,,1987-12-25,WCCW Christmas Star Wars '87,True,0.0,0
12,False,/zLB78pH7SBtP5fDh2ggzhxxgkCn.jpg,"[99, 10770]",35795,en,From 'Star Wars' to 'Jedi' : The Making of a Saga,"From Star Wars to Jedi: The Making of a Saga is a 1983 television documentary special that originally aired on PBS. It is a behind-the-scenes look at the making of the original Star Wars trilogy, with particular emphasis on the final film, Return of the Jedi. Narrated by actor Mark Hamill, the documentary was written by Richard Schickel who had written the previous television documentaries The Making of Star Wars (1977) and SP FX: The Empire Strikes Back (1980).",2.433,/aRxLGvPgkKnnumTgVA5R88Y5eok.jpg,1983-12-03,From 'Star Wars' to 'Jedi' : The Making of a Saga,False,6.9,14
13,False,/1zsTv4K3ZuDMA5YXwEUCnf9hU0p.jpg,[99],658336,en,The Galaxy Britain Built: The British Force Behind Star Wars,"Superfan David Whiteley celebrates the unsung British heroes behind the first film in the Star Wars’ franchise, 1977’s eponymously titled Star Wars.  The Star Wars saga ends with the release of The Rise of Skywalker in December 2019. This documentary celebrates where it all began. It includes previously unheard stories from the people who made one of the most successful movies of all time, with additional interviews and previously unseen behind-the-scenes footage.  The presenter, Star Wars superfan David Whiteley, who has his own connection to the original film (he was born on May the 4th), tracks down the often modest British talent who brought the galaxy to life.  David explores the contribution of the London Symphony Orchestra and meets Ann Skinner, who was in charge of continuity. As well as seeing her original stills from the set, Ann reveals how she helped Sir Alec Guinness with one of the most famous speeches in Star Wars.",3.48,/zcpiyvo70WYZmZ2DDYKz3LRe4HQ.jpg,2017-12-21,The Galaxy Britain Built: The British Force Behind Star Wars,False,10.0,1
14,False,/n5dk0NXOkQyhRWirTHXe0xRV6vJ.jpg,[99],363132,en,Star Wars Begins: A Filmumentary,"Filmmaker Jamie Benning has finally finished his trilogy of documentary-commentaries. This final chapter concentrates on the first Star Wars film. Like his two previous documentaries, Building Empire (2006) and Returning to Jedi (2007), Star Wars Begins is an unofficial look at the creation of the classic movie and features deleted scenes, alternate takes and different angles, bloopers, original on set audio recordings and a huge amount of commentary from cast and crew, culled from every corner of the galaxy.",1.201,/dVs0AahiYdy4axUnoNZ2Fl3sPxj.jpg,2011-02-02,Star Wars Begins: A Filmumentary,False,5.7,3
15,False,,"[10751, 10770]",757151,en,Star Wars Quiz,Plot unknown,0.6,,2017-11-24,Star Wars Quiz,False,0.0,0
16,False,,[],657296,en,Star Wars Dreams,"A look at the history of America's multi-billion dollar missile defence system, from  President Eisenhower to Reagan and Bush.",0.6,,2003-05-13,Star Wars Dreams,False,0.0,0
17,False,,[],729605,en,Star Wars: Rise of Skywalker Documentary,Documentaries including:  The Skywalker Legacy  Pasaana Pursuit: Creating the Speeder Chase  Aliens in the Desert  D-O: Key to the Past  Warwick & Son  Cast of Creatures  Digital Exclusive: The Maestro’s Finale,1.506,/mok6E7OTshtOCg3a04aHENVmEii.jpg,2019-03-17,Star Wars: Rise of Skywalker Documentary,False,6.0,1
18,False,/wz6ifU1weVkK2whJWzm2pUgizhg.jpg,"[99, 10770]",485997,en,Star Wars: The Magic & the Mystery,"Host Howie Long takes viewers on a tour of the ""Star Wars"" universe, as Fox TV celebrates the re-release of the original three legendary films in this one hour special.",1.296,/8TKZNYSI62UxBxhrhDeFaiYbQki.jpg,1997-02-06,Star Wars: The Magic & the Mystery,False,0.0,0
19,False,,[],777744,en,WCCW Christmas Star Wars '81,Christmas Day bring the action and excitement of World Class Championship Wrestling comes in the form of season's beatings when the Von Erich boys ride into town.,0.826,,1981-12-25,WCCW Christmas Star Wars '81,True,0.0,0
0,False,/bYWxAEsDeTDVA52q0Y68HSQ62bl.jpg,[28],431575,en,The Rogue One: A Star Wars Toy Story,"Craving the attention of her busy father, a 7-year-old Star Wars fan disobeys him and starts a rebellion with his Star Wars toy collection that would have surprising consequences.",2.101,/cmISLMJiaE6iNJx7xLpnmfdq2UL.jpg,2016-12-15,The Rogue One: A Star Wars Toy Story,False,6.6,16
1,False,,[],528694,en,K-1 Star Wars '96,K-1 Star Wars '96,0.6,,,K-1 Star Wars '96,False,10.0,1
2,False,,"[878, 28, 12]",761171,en,Untitled Kevin Feige Star Wars Film,An upcoming Star Wars film produced by Kathleen Kennedy and Kevin Feige.,1.295,/vcvgCoNKQzbkXfekFwx1pjg8ejM.jpg,,Untitled Kevin Feige Star Wars Film,False,0.0,0
3,False,,[],778832,en,WCCW Christmas Star Wars '85,Witness a brutal battle when The Von Erichs clash with The Freebirds,0.726,,1985-12-25,WCCW Christmas Star Wars '85,True,0.0,0
4,False,,[99],412561,en,The Secret of Star Wars,"Dev explores what makes Star Wars one of the most loved, successful and hyped franchises of all time, and interviews new stars John Boyega, Daisy Ridley and director J.J. Abrams.  What is the secret of Star Wars? For nearly 40 years it has broken box office records, inspired devotion among millions of fans worldwide, and created unprecedented levels of hype in the lead-up to each new film. What is the reason for the franchise’s appeal, even among young people who may never have seen one of the previous six films?",0.943,/7xSt0PMwWaiML0zP9tKqueh96DA.jpg,2015-12-11,The Secret of Star Wars,True,1.0,2
5,False,,"[878, 28, 12]",700330,en,Untitled Taika Waititi Star Wars Film,"Academy Award winner Taika Waititi, who recently won Best Adapted Screenplay for Jojo Rabbit and directed the widely-acclaimed first season finale episode of The Mandalorian on Disney+, will direct and co-write a new Star Wars feature film for theatrical release. Joining Waititi on the screenplay will be Academy Award nominee Krysty Wilson-Cairns (1917, Last Night in Soho), who received a BAFTA Award for Outstanding British Film of the Year on the three-time Oscar-winning film, 1917. A release date for the project has not yet been announced. Plot unknown.",1.257,,,Untitled Taika Waititi Star Wars Film,False,0.0,0
6,False,,"[878, 28, 12]",486215,en,Untitled Star Wars Trilogy: Episode I,"The first in a trilogy of films, separate from the episodic Skywalker Saga.",1.248,,,Untitled Star Wars Trilogy: Episode I,False,0.0,0
7,False,,[99],376798,en,Star Wars: Evolution of the Lightsaber Duel,"Though lightsabers have been a force in the Star Wars galaxy since George Lucas’ original film, the weapon’s on-screen presence evolved throughout both cinematic trilogies and into Star Wars: The Force Awakens. SportsCenter is tracing the lightsaber’s lineage through the films, and a new trailer for the special will definitely delight any fan’s inner Star Wars Kid.",1.289,/5HkFKwZW86JTco4t5316leKZ12Z.jpg,2015-12-15,Star Wars: Evolution of the Lightsaber Duel,False,4.5,7
8,False,,"[99, 10770]",659114,en,The Mythology of Star Wars,George Lucas discusses how Joseph Campbell and his concept of the Monomyth (aka the Hero's Journey) and other concepts from mythology and religion shaped the Star Wars saga.,0.928,/5WuskhEgSVev8p3ronVRFA2d4ux.jpg,2000-09-01,The Mythology of Star Wars,False,0.0,0
9,False,,[35],405572,en,Star Wars Directed by Ken Loach,Trailer for Ken Loach's new sci fi movie set in Northern England. (Sort of.) A parody by Haiste and Lawrence.  First Prize ShortCom 2016 jury select winner.,0.6,,2015-08-21,Ken Loach's Star Wars,False,0.0,0
10,False,,[99],515580,en,How Star Wars Was Saved in the Edit,"Joey Scoma demonstrates how Star Wars (1977), a potential disaster in its rough cut, was saved in the editing.",1.83,/7nCnXxIqwETBDqpThq8ii3naKCC.jpg,2017-12-07,How Star Wars Was Saved in the Edit,False,7.0,2
11,False,,[35],351651,en,The Untitled Star Wars Mockumentary,Damon Packard parodies the making of Star Wars: Attack of the Clones.,0.907,,2003-06-25,The Untitled Star Wars Mockumentary,False,5.0,1
12,False,,[],482287,en,The Stars of Star Wars,Interviews with the cast of all the Star Wars films and inside info on the films.,0.878,/pOIccovMDv11T7GAVR0C0d3vi7G.jpg,1999-10-20,The Stars of Star Wars,True,5.0,1
13,False,,"[878, 28, 12]",486217,en,Untitled Star Wars Trilogy: Episode III,"The third in a trilogy of films, separate from the episodic Skywalker Saga.",1.176,,,Untitled Star Wars Trilogy: Episode III,False,0.0,0
14,False,,[],811318,en,WCCW Thanksgiving Star Wars,Kerry Von Erich and Michael Hayes clash in a steel cage in a loser leaves town match.,0.6,,1983-11-24,WCCW Thanksgiving Star Wars,True,0.0,0
15,False,,[878],839036,en,Death Sticks: A Star Wars Story,This film takes place shortly after the events of The Phantom Menace and follows Anakin Skywalker on his journey to become a Jedi Knight.,1.102,/A5nyzE3TplDkNH0r0az9KhXYecR.jpg,2017-11-30,Kid Anakin Movie,True,0.0,0
16,False,,[],778612,en,WCCW Christmas Star Wars '84,"Kerry Von Erich seeks revenge and The NWA World's Heavyweight Championship from ""The Nature Boy"" Ric Flair.",0.6,,1984-12-25,WCCW Christmas Star Wars '84,True,0.0,0
17,False,,[],777740,en,WCCW Star Wars (February 1981),"Kerry Von Erich gets his shot at the NWA World's Heavyweight Championship. But to become a champion ""The Modern-Day Warrior"" will need to topple NWA kingpin Harley Race.",0.6,,1981-02-22,WCCW Star Wars (February 1981),True,0.0,0
18,False,,"[16, 878]",796408,en,Star Wars Rebels: Property of Ezra Bridger,"In “Property of Ezra Bridger,” a special Star Wars Rebels short, Ezra finds a downed TIE fighter on the plains of Lothal. The young rebel opens the ship’s hatch -- pretending to help the ungrateful Imperial pilot -- and leaves with a few souvenirs.",1.261,/u14Wds1CL8yYsE47H1A0TOrogxK.jpg,2014-09-01,Star Wars Rebels: Property of Ezra Bridger,False,0.0,0
19,False,,[99],721334,en,Star Wars: Episode III - Making the Game,"After you witness the stunning Jedi action in Episode III, you can experience it yourself in the Star Wars: Episode III video game. Discover how game developers at LucasArts worked closely on set and behind the scenes with George Lucas, cast and crew to create the most authentic Jedi experience ever. With the collaboration of Lucas, stunt coordinator Nick Gillard, and Hayden Christensen, Episode III is the first game that truly gives you all the powers of a Jedi Knight.",0.87,/qNT8gxk6XLM7LBzUDmTlGzc5i4S.jpg,,Star Wars: Episode III - Making the Game,False,10.0,1
0,False,/bjp1gezn4DzP8juI3ZvjN4uPlsK.jpg,"[99, 35, 9648]",638738,en,The Empire Strikes Door (A Star Wars Mystery),A thrilling comedic documentary attempting to uncover the mystery of who is responsible for one of the most infamous bloopers in cinematic history.,1.523,/mRGS7AdkSOBTGNdfD5Q5TusHtez.jpg,2019-09-25,The Empire Strikes Door (A Star Wars Mystery),False,8.0,1
1,False,,"[99, 878]",713695,en,Star Wars vs. Star Trek: The Rivalry Continues,"For years, STAR WARS fan have squared off against STAR TREK fans over which space fantasy is the better choice. As a result, both franchises have been embroiled in a continuing battle for merchandise sales, publicity and box-office receipts. The science-fiction genre has never seen anything like it and, as these fictional universes continue to expand, the competition seems to be never ending. Star Wars vs. Star Trek: The Rivalry Continues compares the space opera worlds of George Lucas and Gene Roddenberry for a one-of-a-kind intergalactic documentary.",1.237,/3QjqzSGuH10u2vfvzuvX7e2xQ8L.jpg,2002-01-01,Star Wars vs. Star Trek: The Rivalry Continues,False,0.0,0
2,False,,"[878, 28, 12]",486216,en,Untitled Star Wars Trilogy: Episode II,"The second in a trilogy of films, separate from the episodic Skywalker Saga.",0.921,,,Untitled Star Wars Trilogy: Episode II,False,0.0,0
3,False,,[],700448,en,Star Wars: The Clone Wars - The Nightsisters Trilogy,"A home video compilation film of the Star Wars: The Clone Wars episodes ""Nightsisters,"" ""Monster,"" and ""Witches of the Mist,"" cut together. Originally shown at select screenings in 2010 (mainly at conventions), and it was published as an iTunes digital download on December 5, 2011.",1.209,/oWSdEKsNIJTxGjs6OIebsRLjJrX.jpg,2011-12-05,Star Wars: The Clone Wars - The Nightsisters Trilogy,True,9.3,3
4,False,,[],426860,en,Pro Wrestling USA: Star Wars 1985,"February 24, 1985 in East Rutherford, NJ",0.881,,,Pro Wrestling USA: Star Wars 1985,False,10.0,1
5,False,,[99],485994,en,The Force Is with Them: The Legacy of Star Wars,"The Force Is with Them: The Legacy of Star Wars is a Video Documentary included in the 2004 DVD of the Star Wars Original Trilogy. It explained the impact of ""Star Wars"" on various directors and actors.",1.522,/59NPEeoYphSnAhgQvf31PWgaK1D.jpg,2004-09-21,The Force Is with Them: The Legacy of Star Wars,True,6.5,2
6,False,,[],778592,en,WCCW Star Wars (June 1983),Kevin Von Erich tangles with NWA World's Heavyweight Champion Harley Race with the 'Ten Pounds of Gold' up for grabs!,0.6,,1983-06-17,WCCW Star Wars (June 1983),True,0.0,0
7,False,,"[878, 28]",896393,en,Star Wars: The Old Republic,A Star Wars film set during the era of The Old Republic.,0.6,,,Star Wars: The Old Republic,False,0.0,0
8,False,,"[878, 28]",896396,en,Star Wars: The High Republic,A Star Wars film set during the era of The High Republic.,0.6,,,Star Wars: The High Republic,False,0.0,0
9,False,,[878],368729,es,Star Wars: The Holo Xperience,"The Rebels come into the forest on the planet Endor. A soldier stays behind to guard the ship, but soon a pair of Imperial Scout Troopers arrive to investigate, and the mission is in danger of being discovered.",0.6,,2013-10-24,Star Wars: The Holo Xperience,False,0.0,0
10,False,,[],778215,en,WCCW Star Wars (August 1982),It's Kerry Von Erich vs. Ric Flair with the NWA World's Heavyweight Championship on the line in a grueling best 2 of 3 falls contest!,0.6,,1982-08-15,WCCW Star Wars (August 1982),True,0.0,0
11,False,,[99],701034,fr,Star Wars : La Révolution Visuelle,,0.6,,2020-05-04,Star Wars : La Révolution Visuelle,True,3.0,1
12,False,,[],778961,en,WCCW Labor Day Star Wars '86,It's Roode vs. Adams with all the gold on the line in The Lone Star State,0.6,,1986-09-01,WCCW Labor Day Star Wars '86,True,0.0,0
13,False,,[99],294822,en,Hollywood Rivals: Star Wars vs. Star Trek,"Star Wars vs. Star Trek. George Lucas, Liam Neeson, Samuel L. Jackson, Natalie Portman, Mark Hamill, Carrie Fisher and Harrison Ford share insights and the special effects creator compares the worlds of Star Trek and Star Wars.",0.827,/tEacV6cPxe9nznaMkoZp3A6rAUQ.jpg,2001-10-19,Hollywood Rivals: Star Wars vs. Star Trek,False,7.5,1
14,False,,[],777791,en,Lego Star Wars: Battle of Sebiris,"General Obi-Wan Kenobi has found himself in trouble with the separatist army and has only just escaped with very few troops remaining. Separatist leader General Grievous has been working closely with Darth Sidious on a new weapon that they plan to unleash to the republic. This weapon has been constructed without the republic knowing about it, on the hot and forest planet Sebiris located on the outer rim. Commander Cody has recently been assigned to lead a small group of clone troopers in discovering and disarming this new weapons facility before it wipes out the republic....",0.706,/aIhCVBUDEbJONtkjat2j0EzhKNv.jpg,2016-10-12,Lego Star Wars: Battle of Sebiris,False,6.0,2
15,False,,[878],690208,en,Star Wars: Path of the Jedi,"Star Wars: Path of the Jedi is a 10-minute montage of memorable moments from all seven of the Star Wars movies. Rather than try to recap the plot of the first six films, Path of the Jedi takes iconic images and dialogue from the saga and stitches them together thematically instead of chronologically.",0.6,,2015-11-16,Star Wars: Path of the Jedi,False,0.0,0
16,False,,[99],372909,en,How Star Wars Changed the World,"Documentary taking a warm and celebratory look at the countless ways the Star Wars universe has inspired fans all over the globe. Whether it be adhering to the scriptures of Jedi, perfecting one's light-saber skills, designing a Wookie costume, or making a self-financed fan film, this show revels in the bright side of the Force.",0.6,,2015-12-11,How Star Wars Changed the World,False,5.5,2
17,False,,[],359414,en,Lego Star Wars: The Complete Brick Saga So Far,"LEGO Star Wars is a series of TV Movies telling stories from the Star Wars universe using the distinctive characters from the world of LEGO and the animation style of the LEGO Star Wars computer games. Starting in 2005; the first film ""Revenge of the Brick"" was created to coincide with the theatrical release of Revenge of the Sith.",0.824,,2011-09-01,Lego Star Wars: The Complete Brick Saga So Far,True,6.3,4
18,False,,[],774692,en,LEGO Star Wars: The Han Solo Affair,"From between the scenes of The Empire Strikes Back, it's the Han Solo Affair!  Han Solo's friends hatch a plan to rescue him from the clutches of Darth Vader and Boba Fett.  Will they succeed? Find out in this wacky Star Wars adventure!",0.6,/dxubj4jsBjFYJaraP2njHzEyboQ.jpg,,LEGO Star Wars: The Han Solo Affair,False,5.5,3
19,False,/xsDBlX7V2gNAbs5ksD8h0h2PO92.jpg,[10402],509770,en,The Star Wars Suite – The Danish National Symphony Orchestra,"On June 2017,  the Danish Broadcasting Corporation (DR) hosted three orchestral concerts called Galaxymphony which included some of the soundtrack from various space and sci-fi movies. This is their version of some of the Star Wars soundtrack across all seven movies.  The concert was hosted by Jakob Stegelmann and conducted by Antony Hermus. The performance was orchestrated by The Danish National Symphony Orchestra with help from the 'Camerata' and 'Hymnia' choirs. As told in the video, the host, Jakob Stegelmann, is very passionate about the Star Wars films and therefore evidently the main event of the concert. Therefore, I have shared this extra long video (what a horror it was to render) for you to enjoy.",0.6,/xtDalKKBuJ9X8kG1WpKe7RfH10U.jpg,2007-06-01,The Star Wars Suite – The Danish National Symphony Orchestra,False,0.0,0
0,False,/eQCaAnFJW4Q0wlTI5fxExsFnLnR.jpg,"[878, 28]",858174,en,A Blaster In The Right Hands: A Star Wars Story,"Two bounty hunters - a ruthless Pantoran and Twi’lek refugee, cross paths while attempting to obtain a valuable cargo from a crashed imperial shuttle. But they soon discover they’re not the only hired gun around.  Filmed in Picton NSW, Australia, A Blaster In The Right Hands: A Star Wars Story is a fan-film and a homage to classic Spaghetti Westerns and 'Star Wars'. Produced by LUNACRAFT PRODUCTIONS from director Richard de Carvalho and Producer Carol Jovicic, amongst their talented and passionate team of artists, featuring make-up FX prosthetics by ODD STUDIO (Mad Max: Fury Road, Alien: Covenant) with post-production completed at Sydney's POW WOW STUDIOS (Mad Max: Fury Road, Gods Of Egypt).  'A Blaster in The Right Hands: A Star Wars Story' is a non-profit unofficial fan-film that is not intended for commercial use produced by Lunacraft Productions. 'Star Wars' is owned by Lucasfilm/Disney and this fan-film is not connected in any way to said companies.",0.737,/A9XYrXeLM12qtP7OVBjHi9zOwIn.jpg,2021-05-31,A Blaster In The Right Hands: A Star Wars Story,False,6.0,1
1,False,/w1nyNG8xEDMeJrqELerYySF2KaX.jpg,[99],656161,en,Toy Empire: The British Force Behind Star Wars Toys,Superfan David Whiteley celebrates how an unassuming band of designers and factory workers in Leicestershire created the toys which were to define a generation.,0.6,/nOC6Dzrqy1GkrAPSt1tWkdyVPoT.jpg,2019-12-16,Toy Empire: The British Force Behind Star Wars Toys,False,0.0,0
2,False,/dUkCHy02dtFWQwyCKQKlf1sRm0D.jpg,"[16, 12, 10751, 14, 878]",161704,ja,映画ドラえもん のび太の宇宙小戦争,"Papi, the tiny president of a faraway planet, escapes to Earth to avoid being captured by the military forces that took over. Despite being welcomed by Doraemon, Nobita and their friends, the little alien notices that his enemies have also reached this world and doesn't want to get his human friends involved in this war. Doraemon, Nobita, Gian, Suneo, and Shizuka start a big adventure as they try to hide and protect Papi.",7.595,/oLXqorJ3CtXkR90wCBkg4WnITL3.jpg,1985-03-16,Doraemon: Nobita's Little Star Wars,False,6.4,9
